msg_id,sender,receiver,topic,body231,jcolemand,cwarren3c,metus vitae ipsum aliquam non mauris morbi,"Aliquam quis turpis eget elit sodales scelerisque. Mauris sit amet eros. Suspendisse accumsan tortor quis turpis.Sed ante. Vivamus tortor. Duis mattis egestas metus."1407,hpatterson1o,gferguson4m,velit eu,"Morbi porttitor lorem id ligula. Suspendisse ornare consequat lectus. In est risus, auctor sed, tristique in, tempus sit amet, sem."335,jcolemand,bparker63,orci luctus,"Lorem ipsum dolor sit amet, consectetuer adipiscing elit. Proin risus. Praesent lectus.Vestibulum quam sapien, varius ut, blandit non, interdum in, ante. Vestibulum ante ipsum primis in faucibus orci luctus et ultrices posuere cubilia Curae; Duis faucibus accumsan odio. Curabitur convallis."482,ahoward3f,swebb59,congue risus semper porta volutpat quam pede lobortis,"Fusce consequat. Nulla nisl. Nunc nisl.Duis bibendum, felis sed interdum venenatis, turpis enim blandit mi, in porttitor pede justo eu massa. Donec dapibus. Duis at velit eu est congue elementum.In hac habitasse platea dictumst. Morbi vestibulum, velit id pretium iaculis, diam erat fermentum justo, nec condimentum neque sapien placerat ante. Nulla justo."1580,epierce7f,bparker63,semper sapien a,"In sagittis dui vel nisl. Duis ac nibh. Fusce lacus purus, aliquet at, feugiat non, pretium quis, lectus."1521,kcollins6w,chernandez5i,accumsan odio curabitur convallis duis,"Aliquam quis turpis eget elit sodales scelerisque. Mauris sit amet eros. Suspendisse accumsan tortor quis turpis.Sed ante. Vivamus tortor. Duis mattis egestas metus."646,trivera5p,rcollins2j,ipsum dolor sit amet consectetuer adipiscing,"Mauris enim leo, rhoncus sed, vestibulum sit amet, cursus id, turpis. Integer aliquet, massa id lobortis convallis, tortor risus dapibus augue, vel accumsan tellus nisi eu orci. Mauris lacinia sapien quis libero."1244,jhenderson7s,chernandez5i,tincidunt nulla mollis molestie,Etiam vel augue. Vestibulum rutrum rutrum neque. Aenean auctor gravida sem.483,lruiz2y,hpatterson1o,ipsum integer a nibh in quis justo,"Etiam vel augue. Vestibulum rutrum rutrum neque. Aenean auctor gravida sem.Praesent id massa id nisl venenatis lacinia. Aenean sit amet justo. Morbi ut odio."1059,jperez3a,rknight4k,purus phasellus in felis donec semper,"Mauris enim leo, rhoncus sed, vestibulum sit amet, cursus id, turpis. Integer aliquet, massa id lobortis convallis, tortor risus dapibus augue, vel accumsan tellus nisi eu orci. Mauris lacinia sapien quis libero.Nullam sit amet turpis elementum ligula vehicula consequat. Morbi a ipsum. Integer a nibh."658,gferguson4m,aadams29,pede ac diam cras pellentesque volutpat,"Sed sagittis. Nam congue, risus semper porta volutpat, quam pede lobortis ligula, sit amet eleifend pede libero quis orci. Nullam molestie nibh in lectus.Pellentesque at nulla. Suspendisse potenti. Cras in purus eu magna vulputate luctus."1174,hpatterson1o,kcollins6w,nam congue risus semper porta volutpat quam,"Phasellus sit amet erat. Nulla tempus. Vivamus in felis eu sapien cursus vestibulum.Proin eu mi. Nulla ac enim. In tempor, turpis nec euismod scelerisque, quam turpis adipiscing lorem, vitae mattis nibh ligula nec sem."185,swebb59,kcollins6w,nisl ut volutpat sapien arcu sed augue aliquam,"Sed ante. Vivamus tortor. Duis mattis egestas metus.Aenean fermentum. Donec ut mauris eget massa tempor convallis. Nulla neque libero, convallis eget, eleifend luctus, ultricies eu, nibh.Quisque id justo sit amet sapien dignissim vestibulum. Vestibulum ante ipsum primis in faucibus orci luctus et ultrices posuere cubilia Curae; Nulla dapibus dolor vel est. Donec odio justo, sollicitudin ut, suscipit a, feugiat et, eros."1901,jperez3a,rcollins2j,ac tellus semper interdum mauris ullamcorper purus sit,"Aenean lectus. Pellentesque eget nunc. Donec quis orci eget orci vehicula condimentum.Curabitur in libero ut massa volutpat convallis. Morbi odio odio, elementum eu, interdum eu, tincidunt in, leo. Maecenas pulvinar lobortis est."938,mmccoy6x,ccarra,mi in porttitor pede justo eu massa,"Sed sagittis. Nam congue, risus semper porta volutpat, quam pede lobortis ligula, sit amet eleifend pede libero quis orci. Nullam molestie nibh in lectus.Pellentesque at nulla. Suspendisse potenti. Cras in purus eu magna vulputate luctus.Cum sociis natoque penatibus et magnis dis parturient montes, nascetur ridiculus mus. Vivamus vestibulum sagittis sapien. Cum sociis natoque penatibus et magnis dis parturient montes, nascetur ridiculus mus."359,gcook2x,amoore1p,curae mauris viverra diam,Praesent id massa id nisl venenatis lacinia. Aenean sit amet justo. Morbi ut odio.751,lkelley2m,rray2n,luctus tincidunt nulla mollis molestie lorem,Nulla ut erat id mauris vulputate elementum. Nullam varius. Nulla facilisi.135,cwarren3c,srose8a,tempus vel pede morbi porttitor lorem,"Quisque porta volutpat erat. Quisque erat eros, viverra eget, congue eget, semper rutrum, nulla. Nunc purus.Phasellus in felis. Donec semper sapien a libero. Nam dui."1717,ahoward3f,gferguson4m,pulvinar lobortis est phasellus,"Duis bibendum, felis sed interdum venenatis, turpis enim blandit mi, in porttitor pede justo eu massa. Donec dapibus. Duis at velit eu est congue elementum.In hac habitasse platea dictumst. Morbi vestibulum, velit id pretium iaculis, diam erat fermentum justo, nec condimentum neque sapien placerat ante. Nulla justo."234,bparker63,cwarren3c,nisl duis ac nibh fusce lacus purus,"Curabitur gravida nisi at nibh. In hac habitasse platea dictumst. Aliquam augue quam, sollicitudin vitae, consectetuer eget, rutrum at, lorem.Integer tincidunt ante vel ipsum. Praesent blandit lacinia erat. Vestibulum sed magna at nunc commodo placerat."651,gferguson4m,srose8a,platea dictumst maecenas ut massa quis augue luctus,"Curabitur gravida nisi at nibh. In hac habitasse platea dictumst. Aliquam augue quam, sollicitudin vitae, consectetuer eget, rutrum at, lorem.Integer tincidunt ante vel ipsum. Praesent blandit lacinia erat. Vestibulum sed magna at nunc commodo placerat."63,cwarren3c,swebb59,a libero nam,"Vestibulum quam sapien, varius ut, blandit non, interdum in, ante. Vestibulum ante ipsum primis in faucibus orci luctus et ultrices posuere cubilia Curae; Duis faucibus accumsan odio. Curabitur convallis.Duis consequat dui nec nisi volutpat eleifend. Donec ut dolor. Morbi vel lectus in quam fringilla rhoncus.Mauris enim leo, rhoncus sed, vestibulum sit amet, cursus id, turpis. Integer aliquet, massa id lobortis convallis, tortor risus dapibus augue, vel accumsan tellus nisi eu orci. Mauris lacinia sapien quis libero."489,bmatthews1c,mwashington2q,dictumst maecenas ut massa,"Maecenas leo odio, condimentum id, luctus nec, molestie sed, justo. Pellentesque viverra pede ac diam. Cras pellentesque volutpat dui.Maecenas tristique, est et tempus semper, est quam pharetra magna, ac consequat metus sapien ut nunc. Vestibulum ante ipsum primis in faucibus orci luctus et ultrices posuere cubilia Curae; Mauris viverra diam vitae quam. Suspendisse potenti.Nullam porttitor lacus at turpis. Donec posuere metus vitae ipsum. Aliquam non mauris."1777,trivera5p,bdaniels1g,suspendisse potenti cras in purus eu magna,Aenean lectus. Pellentesque eget nunc. Donec quis orci eget orci vehicula condimentum.1644,hpatterson1o,epierce7f,pede malesuada,"Curabitur gravida nisi at nibh. In hac habitasse platea dictumst. Aliquam augue quam, sollicitudin vitae, consectetuer eget, rutrum at, lorem.Integer tincidunt ante vel ipsum. Praesent blandit lacinia erat. Vestibulum sed magna at nunc commodo placerat.Praesent blandit. Nam nulla. Integer pede justo, lacinia eget, tincidunt eget, tempus vel, pede."54,hgarza4n,hpatterson1o,aliquet pulvinar,"Mauris enim leo, rhoncus sed, vestibulum sit amet, cursus id, turpis. Integer aliquet, massa id lobortis convallis, tortor risus dapibus augue, vel accumsan tellus nisi eu orci. Mauris lacinia sapien quis libero.Nullam sit amet turpis elementum ligula vehicula consequat. Morbi a ipsum. Integer a nibh."1532,gferguson4m,mwashington2q,donec semper sapien,"Cum sociis natoque penatibus et magnis dis parturient montes, nascetur ridiculus mus. Vivamus vestibulum sagittis sapien. Cum sociis natoque penatibus et magnis dis parturient montes, nascetur ridiculus mus.Etiam vel augue. Vestibulum rutrum rutrum neque. Aenean auctor gravida sem."347,hpatterson1o,sburns7p,sollicitudin mi sit amet,Duis aliquam convallis nunc. Proin at turpis a pede posuere nonummy. Integer non velit.1591,rknight4k,drobinson7v,porttitor id,"Fusce consequat. Nulla nisl. Nunc nisl.Duis bibendum, felis sed interdum venenatis, turpis enim blandit mi, in porttitor pede justo eu massa. Donec dapibus. Duis at velit eu est congue elementum.In hac habitasse platea dictumst. Morbi vestibulum, velit id pretium iaculis, diam erat fermentum justo, nec condimentum neque sapien placerat ante. Nulla justo."2033,epierce7f,ccarra,posuere cubilia curae nulla dapibus dolor vel est,"Mauris enim leo, rhoncus sed, vestibulum sit amet, cursus id, turpis. Integer aliquet, massa id lobortis convallis, tortor risus dapibus augue, vel accumsan tellus nisi eu orci. Mauris lacinia sapien quis libero."791,rcollins2j,swebb59,amet lobortis sapien sapien non mi,"Aliquam quis turpis eget elit sodales scelerisque. Mauris sit amet eros. Suspendisse accumsan tortor quis turpis.Sed ante. Vivamus tortor. Duis mattis egestas metus."130,jperez3a,chernandez5i,est donec odio justo,"Mauris enim leo, rhoncus sed, vestibulum sit amet, cursus id, turpis. Integer aliquet, massa id lobortis convallis, tortor risus dapibus augue, vel accumsan tellus nisi eu orci. Mauris lacinia sapien quis libero."800,srose8a,gcook2x,id sapien in sapien iaculis congue vivamus,Maecenas ut massa quis augue luctus tincidunt. Nulla mollis molestie lorem. Quisque ut erat.623,srose8a,bmatthews1c,ante ipsum primis in,"Vestibulum ac est lacinia nisi venenatis tristique. Fusce congue, diam id ornare imperdiet, sapien urna pretium nisl, ut volutpat sapien arcu sed augue. Aliquam erat volutpat.In congue. Etiam justo. Etiam pretium iaculis justo."571,rcollins2j,gferguson4m,donec quis orci eget,"Curabitur gravida nisi at nibh. In hac habitasse platea dictumst. Aliquam augue quam, sollicitudin vitae, consectetuer eget, rutrum at, lorem."354,ahoward3f,lkelley2m,sit amet,"Duis aliquam convallis nunc. Proin at turpis a pede posuere nonummy. Integer non velit.Donec diam neque, vestibulum eget, vulputate ut, ultrices vel, augue. Vestibulum ante ipsum primis in faucibus orci luctus et ultrices posuere cubilia Curae; Donec pharetra, magna vestibulum aliquet ultrices, erat tortor sollicitudin mi, sit amet lobortis sapien sapien non mi. Integer ac neque."51,swebb59,epierce7f,rhoncus aliquet pulvinar sed nisl,"Proin leo odio, porttitor id, consequat in, consequat ut, nulla. Sed accumsan felis. Ut at dolor quis odio consequat varius.Integer ac leo. Pellentesque ultrices mattis odio. Donec vitae nisi."846,srose8a,bnguyen3n,tellus nisi eu,"Nullam sit amet turpis elementum ligula vehicula consequat. Morbi a ipsum. Integer a nibh.In quis justo. Maecenas rhoncus aliquam lacus. Morbi quis tortor id nulla ultrices aliquet.Maecenas leo odio, condimentum id, luctus nec, molestie sed, justo. Pellentesque viverra pede ac diam. Cras pellentesque volutpat dui."1079,rknight4k,lhartj,dapibus augue vel accumsan tellus,Etiam vel augue. Vestibulum rutrum rutrum neque. Aenean auctor gravida sem.424,gferguson4m,mmccoy6x,cras non velit,"Duis consequat dui nec nisi volutpat eleifend. Donec ut dolor. Morbi vel lectus in quam fringilla rhoncus.Mauris enim leo, rhoncus sed, vestibulum sit amet, cursus id, turpis. Integer aliquet, massa id lobortis convallis, tortor risus dapibus augue, vel accumsan tellus nisi eu orci. Mauris lacinia sapien quis libero."